"candidato_id","nome","nome_urna","partido_sigla"
250000623956,"MARIO FERREIRA","MARIO FERREIRA","PT"
250000624010,"ENI FERNANDES","ENI FERNANDES","PT"
250000624382,"JOSILDA DE ARAÚJO CABRAL DO NASCIMENTO","JO ARAÚJO","PT"
250000624024,"JOZY ELLEN DIAS SOUZA DE LEMOS","JOZY LEMOS","PT"
250000623912,"JULIANA FRAGA E SILVA DE SOUZA","JULIANA FRAGA","PT"
250000623908,"FRANCISCO DAS CHAGAS FRANCILINO","FRANCISCO CHAGAS","PT"
250000624023,"JOSÉ CARLOS DE AQUINO","CARLOS AQUINO","PT"
250000624384,"PATRICIA RODRIGUES DA SILVA","PATRICIA RODRIGUES - PAGU","PT"
250000623990,"ANTONIO ROBERTO DE SOUZA","ROBERTO ENFERMEIRO","PT"
250000623931,"ANDRE BASTIANON PONTES","ANDRE BASTIANON","PT"
250000623932,"ARNOR BARBOSA DOS SANTOS","ARNOR BARBOSA","PT"
250000623960,"PAULA FRANCINETE COSTA LEITE","PAULA LEITE","PT"
250000623971,"JORGE AUGUSTO ROQUE SOUZA","JORGE ROQUE","PT"
250000624059,"SIMONE DINIZ DI STADIO DE ARAUJO","SIMONE PROTETORA DOS ANIMAIS","PT"
250000623903,"EDUARDO MARCHIORI LEITE DA SILVA","EDUARDO LEITE","PT"
250000623996,"CÁSSIA GONÇALVES DE JESUS","CÁSSIA GONÇALVES","PT"
250000624018,"HAMILTON PEREIRA","HAMILTON PEREIRA","PT"
250000624068,"VALQUIRIA JUSTINO","VALQUIRIA JUSTINO","PT"
250000623981,"ALEX SANDRO GOMES","ALEX MINDUÍN","PT"
250000623935,"CLAUDIO RAMOS MOREIRA","CLAUDIO RAMOS","PT"
250000624049,"PEDRO FELIPE JACYNTHO DOS SANTOS","PEDRO FELIPE","PT"
250000623959,"OCIDENE JANUARIO DA SILVA SANTANA","SANTANA","PT"
250000624016,"GERALDO LEITE DA CRUZ","GERALDO CRUZ","PT"
250000624060,"TELMA FORTUNATO DA SILVA SANT ANNA","TELMA SANT ANNA","PT"
250000624039,"MARLEIDE SOARES DA SILVA","MARLEIDE SOARES","PT"
250000624047,"PAULO CESAR GOMES MARTINS","PAULO GAÚCHO","PT"
250000624041,"MOHAMAD SAMI EL KADRI","MOHAMED EL KADRI","PT"
270000620990,"MARILENE FRANCISCA ROCHA","PRETINHA","PT"
270000620984,"JOSE ROBERTO RIBEIRO FORZANI","ZÉ ROBERTO","PT"
270000626092,"LUIS ANTONIO FARIA MOTA","DR. LUIS ANTONIO","PT"
270000626126,"MARIA VANIR ILIDIO","MARIA VANIR","PT"
270000620978,"AMALIA MARIA SANTANA DA SILVA","AMALIA SANTANA","PT"
270000626122,"CELIO ALVES DE MOURA","CELIO MOURA","PT"
270000620992,"RAIMUNDO MARCOS SOARES COELHO","RAIMUNDO MARCOS","PT"
270000620985,"FRANCISCO MAURICIO ALVES FRANCELINO","PROF. FRANCISCO FRANCELINO","PT"
270000626123,"CICERA SOARES","CICERA DO PT","PT"
270000620975,"PAULO SOUSA MOREIRA","CAXAPAU","PT"
270000626120,"ADÃO FRANCISCO DE OLIVEIRA","PROFESSOR ADÃO FRANCISCO","PT"
270000620988,"DOMICIO FERNANDES JUNIOR","DOMICIO DO NORDESTE","PT"
270000620995,"SARAY ALVES BATISTA","SARAY ALVES","PT"
270000626124,"JOSE ARIMATEIA DE MACEDO","DR. ARIMATEIA","PT"
270000629137,"JOÃO HELDER VILELA","VILELA","PT"
270000621001,"CLEUDIANE PEREIRA CARDOSO","CLEUDIANE PEREIRA CARDOSO","PT"
270000620991,"ANTONIO MARCOS NUNES BANDEIRA","ANTONIO MARCOS","PT"
270000620981,"TEREZINHA DE JESUS DE ARAUJO COSTA","PROFESSORA TEREZINHA","PT"
270000620994,"SOLANGE JANE TAVARES DUAILIBE DE JESUS","SOLANGE DUAILIBE","PT"
270000620979,"JOESSI FERREIRA DE BRITO","JOESSI DO SKINÃO","PT"
270000626090,"PAULO SARDINHA MOURÃO","PAULO MOURÃO","PT"
270000626125,"JOSE JULIO FERNANDES","JULIO CARTEIRO","PT"
270000620983,"VALMIR RODRIGUES DA SILVA","VALMIR ELETRICISTA","PT"
270000626127,"RONALDO COSTA SOUSA","RONALDINHO","PT"
270000620996,"EUTALIA BARBOSA RODRIGUES NAVES","EUTALIA","PT"
270000626121,"BISMARQUE ROBERTO DE SOUSA MIRANDA","BISMARQUE DO MOVIMENTO","PT"
270000620980,"MARINALDO PASSOS BARROS","HOMEM DA VASSOURA","PT"
270000620976,"GEUVAR SILVA DE OLIVEIRA","GEUVAR","PT"
270000620987,"FABIANO KENJI NOHAMA","PROF. FABIANO KENJI","PT"
270000620982,"CLEA ELOISA DO REGO","PROF. CLEA","PT"
270000620977,"JOSE SALOMÃO JACOBINA AIRES","JOSE SALOMÃO","PT"
270000620989,"JOSE FABRISQUIANO DE ASSIS","FABRISQUIANO","PT"
270000620986,"MARIA DA PAZ ALVES HORTEGAL","PROFESSORA DA PAZ","PT"
270000620993,"THAWANNY RODRIGUES MONTEIRO","THAWANNY JUVENTUDE","PT"
270000620997,"VILMAR SOUSA DE OLIVEIRA","VILMAR SOUSA","PT"
