"candidato_id","nome","nome_urna","partido_sigla"
100000616310,"MARIA CLARA BATA FARIAS","CLARA FARIAS","PT"
100000616315,"RAIMUNDO NONATO DAS CHAGAS RIBEIRO SILVA","SARGENTO CHAGAS","PT"
100000616279,"JACKSON LIMA DA SILVA","PAMELA MARANHÃO LULA","PT"
100000628192,"FRANCISCO DAS CHAGAS SOUSA BATISTA","FRANCISCO BACABAL","PT"
100000628196,"JOAO FELIPE LOPES","JOAO FELIPE","PT"
100000616283,"FRANCINETE TORRES DO VALE ROCHA","PROFESSORA FRAN","PT"
100000628509,"NARA LIZIA SILVA","NARA LIZIA","PT"
100000616305,"CATIA MARIA DO SOCORRO PAZ","CATIA PAZ","PT"
100000616274,"MARIO PIMENTA FERREIRA","PIMENTA","PT"
100000616298,"LUIS HENRIQUE SILVA DE SOUSA","LUIZ HENRIQUE LULA DA SILVA","PT"
100000616313,"JANAIRA ARAUJO PEREIRA","NAIRA DO PT","PT"
130000627054,"PATRÍCIA CARLA DE MELO","PATRÍCIA MELO","PT"
130000628808,"EDVALDO VAZ DE ANDRADE","PROFESSOR EDVALDO","PT"
130000627063,"MARCOS GOBIRA DAMASCENO","MARCOS GOBIRA","PT"
130000628813,"MANOEL VESPUCIO DA COSTA VASCONCELOS","MANOEL VESPUCIO","PT"
130000628815,"JOSÉ CÉSAR DE PAULA","CAPITÃO CÉSAR","PT"
130000628803,"HENRIQUE LAZAROTTI DE OLIVEIRA","HENRIQUE LAZAROTTI","PT"
130000627051,"VIRGILIO GUIMARÃES DE PAULA","VIRGÍLIO GUIMARÃES","PT"
130000628810,"VANDERLEI SANTOS","VANDERLEI DO PT","PT"
130000628817,"FRANCISCO DE SOUZA VIEIRA","FRANCISCO JEQUITI","PT"
130000626963,"MARIA CECILIA FIGUEIREDO OPIPARI","CIÇA","PT"
130000628809,"JOÃO BATISTA FERREIRA","PROFESSOR BATISTA CEBOLA","PT"
130000628819,"JOAQUIM NERES XAVIER DIAS","KINCA DE SALINAS","PT"
130000627038,"IGINO MARCOS DA MATA DE OLIVEIRA","DR. IGINO","PT"
130000627044,"MACAÉ MARIA EVARISTO DOS SANTOS","MACAE EVARISTO","PT"
130000627053,"BEATRIZ DA SILVA CERQUEIRA","BEATRIZ CERQUEIRA","PT"
130000628812,"JOMAR BATISTA GAVIÃO DE CARVALHO","DR. JOMAR GAVIÃO","PT"
130000628804,"GLAÚCIA PEREIRA LAGE ALVES","GLAÚCIA DA FARMÁCIA","PT"
130000626966,"ODAIR JOSÉ DA CUNHA","ODAIR CUNHA","PT"
130000626957,"BERENICE SOUZA DA SILVA","BERENICE DA SILVA","PT"
130000628802,"ROULIAN VIEIRA DO NASCIMENTO","ROULIAN ENTÃO TÁ","PT"
130000626958,"CRISTINA DEL PAPA","CRISTINA DEL PAPA","PT"
130000626948,"MARIA APARECIDA DE JESUS","CIDA DE JESUS","PT"
130000626968,"PAULO JOSÉ CARLOS GUEDES","PAULO GUEDES","PT"
130000627040,"JEAN MARK FREIRE SILVA","DR. JEAN FREIRE","PT"
130000626945,"PEDRO LUIZ NEVES VICTER ANANIAS","PEDRO PATRUS","PT"
130000627030,"CRISTIANO TADEU DA SILVEIRA","CRISTIANO SILVEIRA","PT"
130000626984,"RAFAELA ANDRADE SILVA","RAFAELA ANDRADE","PT"
130000628811,"ENIR FONSECA","ENIR FONSECA","PT"
130000627066,"ULYSSES GOMES DE OLIVEIRA NETO","ULYSSES GOMES","PT"
130000626960,"GILMAR ALVES MACHADO","GILMAR MACHADO","PT"
130000627031,"GEISA GOMES PEREIRA TEIXEIRA","GEISA TEIXEIRA","PT"
130000626980,"ROGERIO CORREIA DE MOURA BAPTISTA","ROGÉRIO CORREIA","PT"
130000626967,"PATRUS ANANIAS DE SOUZA","PATRUS ANANIAS","PT"
130000628818,"MIGUEL CORREA DA SILVA JÚNIOR","MIGUEL CORREA","PT"
130000626962,"JOSÉ LEONARDO COSTA MONTEIRO","LEONARDO MONTEIRO","PT"
130000627047,"NEUZA APARECIDA FERREIRA ALVES","NEUSA MAPA","PT"
130000627060,"MARIA ALVES DE SOUZA","MARIA ALVES","PT"
130000628820,"MIRIAN CRISTINA CORREA ALVES","CRISTINA CORREA","PT"
130000627046,"MARILIA APARECIDA CAMPOS","MARILIA CAMPOS","PT"
130000627062,"NEIVALDO DE LIMA VIRGILIO","PROFESSOR NEIVALDO","PT"
130000627034,"CARLOS MAGNO RIBEIRO COSTA","MAGNO","PT"
130000627029,"ELISA MARIA COSTA","ELISA COSTA","PT"
130000626946,"ARNALDO AUGUSTO GODOY","ARNALDO GODOY","PT"
130000627052,"WHELTON PIMENTEL DE FREITAS","LELECO PIMENTEL","PT"
130000627056,"SILÉSIO MIRANDA PEREIRA","SILÉSIO MIRANDA","PT"
130000628814,"LUIS DO NASCIMENTO","LUISINHO CORREDOR","PT"
130000626942,"FERNANDO DAMATA PIMENTEL","FERNANDO PIMENTEL","PT"
130000628816,"REGINALDO EUCLIDES DOS SANTOS","REGINALDO EUCLIDES","PT"
130000628805,"MARIA DE FATIMA DE JESUS","FATIMA BURGUER","PT"
130000627057,"ANDRÉ QUINTÃO SILVA","ANDRÉ QUINTÃO","PT"
130000626983,"OFÉLIA DE LOURDES HILÁRIO","OFÉLIA","PT"
130000627064,"MARCOS JOSERALDO LEMOS","MARQUINHO DURVAL","PT"
130000626961,"JESUS MARIO DE ALMEIDA LIMA","JÉSUS LIMA","PT"
130000627058,"MARIA DO CARMO LARA PERPETUO","MARIA DO CARMO","PT"
130000626959,"NILMARIO DE MIRANDA","NILMARIO MIRANDA","PT"
130000627059,"ELOISIO DO CARMO LOURENÇO","ELOISIO","PT"
130000626956,"ADELMO CARNEIRO LEÃO","ADELMO LEÃO","PT"
130000626979,"ROBERTO VIEIRA DE CARVALHO","ROBERTO CARVALHO","PT"
130000626944,"DILMA VANA ROUSSEFF","DILMA ROUSSEFF","PT"
130000626982,"JOÃO CARLOS SIQUEIRA","PADRE JOÃO","PT"
130000627055,"CINÉSIO DA SILVA ROCHA","CINÉSIO ROCHA","PT"
130000626964,"MARIA MARGARIDA MARTINS SALOMÃO","MARGARIDA SALOMÃO","PT"
130000627032,"ROBERTO CUPOLILLO","BETÃO","PT"
130000626981,"SABRINA PALMELA BRAUN","SABRINA BRAUN","PT"
130000628807,"JOSE DE FATIMA FELICIO","FELICIO DO METRO","PT"
130000626978,"REGINALDO LAZARO DE OLIVEIRA LOPES","REGINALDO LOPES","PT"
130000628806,"LEONARDO BRUNO ROSSI","LEONARDO ROSSI","PT"
130000627065,"MARILENE ALVES DE SOUZA","LENINHA","PT"
120000620232,"PAULO ROBERTO DA SILVA","PAULINHO ROBERTO","PT"
120000620230,"LUCIENE MARIA DA SILVA","DOUTORA LUCIENE ","PT"
120000620253,"PEDRO CESAR KEMP GONÇALVES","PEDRO KEMP","PT"
120000620267,"ELIAS ISHY DE MATTOS","ELIAS ISHY","PT"
120000620243,"FERMINA CRISTALDO","CHRISTAL DO PT","PT"
120000620245,"VANUSA LESCANO DE OLIVEIRA","VANUSA OLIVEIRA","PT"
120000620249,"MILTON MILHOMEM SANTOS FILHO","MILTON MILHOMEM ","PT"
120000620238,"EMERSON MENEZES DE OLIVEIRA","EMERSON MENEZES ","PT"
120000620234,"AMARILDO VALDO DA CRUZ","AMARILDO CRUZ","PT"
120000620224,"LEILA APARECIDA PINTO","LEILA DO PT","PT"
120000620235,"JAIRO NÓBREGA","JAIRÃO DO PT","PT"
120000620269,"CARLOS ALBERTO MACHADO","MACHADO","PT"
120000620244,"SANDRA AGUAYO","SANDRA KUNÃ MBARETE","PT"
120000620229,"PEDRO ANTONIO AGOSTINHO","PROFESSOR PEDRO AGOSTINHO","PT"
120000620264,"CLARICE DE FATIMA FERMINO","CLARICE DO POVO","PT"
120000620256,"WEBERGTON SUDÁRIO DA SILVA","COMPANHEIRO CORUMBÁ","PT"
120000620248,"LUIZ ALBERTO AVILA SILVA JUNIOR","JÚNIOR DO PT","PT"
120000620259,"SILVIA DENIZ DE CARVALHO","SILVANA DINIZ","PT"
120000620252,"JAIME TEIXEIRA","PROFESSOR JAIME","PT"
120000620265,"ILMAR RENATO GRANJA FONSECA","ILMAR MAMÃO ","PT"
120000620275,"JOÃO BATISTA DOS SANTOS","JOÃO GRANDÃO","PT"
120000620255,"JAIRTO SARAIVA MOREIRA","PROFESSOR JAIRTO SARAIVA","PT"
120000620247,"VANDERLEI JOSE DA SILVA","DR. VANDERLEI","PT"
120000620223,"ROSEMARE DE MOURA","ROSE DO ACAMPAMENTO","PT"
120000620262,"DANIEL ALVES BICALHO","RADIALISTA DANIEL ALVES","PT"
120000620263,"ISABEL DE JESUS ROQUE DUARTE","ISABEL DUARTE","PT"
120000620233,"MIGUEL CORREA DA CUNHA","MIGUELZINHO","PT"
120000620251,"JOSE ALMI PEREIRA MOURA","CABO ALMI","PT"
120000620261,"JOSE ORCIRIO MIRANDA DOS SANTOS","ZECA DO PT","PT"
120000620257,"DIONÉDISON DEMECIO CANDIDO","DIONÉDISON TERENA","PT"
120000620270,"ROMILDA NETO PIZANI","ROMILDA PIZANI","PT"
120000620240,"MARIA REGINA DE MORAES","PROFESSORA MARIA REGINA","PT"
120000620231,"VALMIR LOPES DE SOUZA","MIRO DA ONLINE","PT"
120000620239,"HUMBERTO CARLOS RAMOS AMADUCCI","HUMBERTO AMADUCCI","PT"
120000620246,"ANA PAULA CARDOSO DE SOUZA","PROFESSORA ANA PAULA","PT"
120000620225,"DIVONETE COSTA DE QUEIROZ RIGON","DIVONETE COSTA","PT"
120000620250,"JOSE RODRIGUES DE MATOS","ZEZÃO ","PT"
120000620228,"DANIEL LEMES VASQUES","DANIEL VASQUES","PT"
120000620237,"GILBERTO FERNANDES","GILBERTO FERNANDES","PT"
120000620254,"JOSÉ LAERTE CECILIO TETILA","LAERTE TETILA","PT"
120000620260,"APARECIDA RAMOS DOS SANTOS","CIDA RAMOS","PT"
120000620227,"VALDINEI ALVES DA SILVA","PITÓ","PT"
120000620272,"VANDER LUIZ DOS SANTOS LOUBET","VANDER LOUBET","PT"
120000620242,"JAIRO ARRUDA DE SOUZA","JAIRO ARRUDA","PT"
120000620271,"GLEICE JANE BARBOSA","GLEICE JANE","PT"
120000620241,"GERSON FACCINA","GEL FACCINA ","PT"
120000620226,"CIPRIANO MENDES COSTA","CIPRIANO MENDES","PT"
120000620236,"ITALO MILHOMEM SANTOS ZIKEMURA","MS COLETIVO","PT"
120000620276,"ANTÔNIO LISBOA DE SOUZA JUNIOR","DR. LISBOA","PT"
120000620268,"AMANDA ALBRECHT DE JESUS","AMANDA ALBRECHT","PT"
120000620266,"ALISSON THIESEN BIAZUSSI","ALISSON BIAZUSSI","PT"
120000620274,"GISELLE MARQUES DE ARAUJO","GISELLE MARQUES","PT"
120000620273,"ADRIANO FIRMINO TELES","ADRIANO CARTEIRO","PT"
120000620258,"SERGIO CARLOS MARTINS RIGO","SERGINHO RIGO","PT"
110000621205,"VALDIR MENDES BARRANCO","VALDIR BARRANCO","PT"
110000621206,"HENRIQUE LOPES DO NASCIMENTO","HENRIQUE LOPES DO SINTEP/MT","PT"
110000621198,"LUDIO FRANK MENDES CABRAL","LUDIO CABRAL","PT"
110000609948,"GILMAR SOARES FERREIRA","PROFESSOR GILMAR SOARES","PT"
110000621199,"LUIS BRAZ DE LIMA","LUIS BRAZ","PT"
110000611605,"EDNA LUZIA ALMEIDA SAMPAIO","EDNA SAMPAIO","PT"
280001090070,"VALDIR MENDES BARRANCO","VALDIR BARRANCO","PT"
110000621195,"VALDINÁ DA SILVA FERREIRA","KACO DO CPA","PT"
110000611610,"ROSA NEIDE SANDES DE ALMEIDA","PROFESSORA ROSA NEIDE","PT"
110000621210,"MARIA DA CONCEIÇÃO SANTOS CORTEZ","KOTA CORTEZ","PT"
280001090072,"ENELINDA MARIA APARECIDA DOS SANTOS SCALA","ENELINDA SCALLA","PT"
140000627201,"JOSÉ GERALDO TORRES DA SILVA","ZÉ GERALDO","PT"
140000617671,"OTAVIO DA SILVA NASCIMENTO JUNIOR","PROF. NIC JR MARAJÓ","PT"
140000617657,"ARI DE SOUSA LOUREIRO","PROFESSOR ARI LOUREIRO","PT"
140000617659,"CARLOS ALBERTO BARROS BORDALO","BORDALO","PT"
140000627200,"MILENE RISUENHO LAUANDE","PROF. MILENE","PT"
140000617667,"MANOEL JESUS DE ARAUJO ROCHA","PROFESSOR ROCHA NETTO","PT"
140000627197,"ISRAEL PEREIRA BARROS","MIQUINHA","PT"
140000617670,"MARJORIE OLIVEIRA CALDERARO","MARJORIE","PT"
140000627199,"MARIA MARTA SOUZA COSTA","MARTA COSTA","PT"
140000617655,"ALFREDO CARDOSO COSTA","PROFESSOR ALFREDO COSTA","PT"
140000617664,"ELEN HILDA FARIAS DOS SANTOS","FEIRANTE NEGONA","PT"
140000627196,"ESMERINO NERI BATISTA FILHO","MIRIQUINHO BATISTA","PT"
140000617677,"VINICIO DA SILVA NASCIMENTO","PROFESSOR VINICIO NASCIMENTO","PT"
140000617672,"PAULO AFONSO ESPINDOLA FERREIRA","PAULO AFONSO","PT"
140000617676,"VANDA LUCIA DOS SANTOS SOARES","MÃE VANDA","PT"
140000617658,"BEP KAMINHOROTI XIKRIN","TORQUETE XIKRIN","PT"
140000617675,"TELMA SARAIVA DOS SANTOS","TELMA SARAIVA","PT"
140000617656,"ANDRÉ LUIS ASSUNÇÃO DE FARIAS","PROF. ANDRÉ FARIAS","PT"
140000627194,"AIRTON LUIZ FALEIRO","AIRTON FALEIRO","PT"
140000627203,"MARIA APARECIDA ALVES IGREJA","APARECIDA IGREJA","PT"
140000617663,"DIRCEU TEN CATEN PIES","DIRCEU TEN CATEN","PT"
140000629489,"MARIA LUCIA MACHADO","LUCIA MACHADO","PT"
140000617666,"JOÃO BATISTA UCHOA PEREIRA","JOÃO BATISTA","PT"
140000617662,"DILVANDA FURTADO FARO","DILVANDA FARO","PT"
140000617661,"CARLOS MORAES DE ALBUQUERQUE FILHO","CORRETOR CARLOS ALBUQUERQUE","PT"
140000617669,"MARIO LUCIO DA SILVA SOUZA","IRMÃO MÁRIO","PT"
140000627198,"JOSE ROBERTO OLIVEIRA FARO","BETO FARO","PT"
140000617674,"REGINA LUCIA BARATA PINHEIRO SOUSA","REGINA BARATA","PT"
140000627195,"CLAUDIO ALBERTO CASTELO BRANCO PUTY","PUTY","PT"
140000617673,"REGINA CELIA RODRIGUES DE SOUSA","REGINA CELIA DO PT","PT"
140000617668,"MARIA DO SOCORRO DOS SANTOS JUCÁ","PROFESSORA JUCÁ","PT"
140000617665,"EVERALDO JESUS DE FREITAS","CARTEIRO EVERALDO","PT"
140000627204,"PAULO ROBERTO GALVÃO DA ROCHA","PAULO ROCHA","PT"
140000617660,"CARLOS EDUARDO CARDOSO MARTINS","CARLOS MARTINS","PT"
140000627202,"MANOEL RAIMUNDO CARVALHO MORAES","RAI MORAES","PT"
150000604409,"RAFAEL REGINALDO DO NASCIMENTO","PROFESSOR RAFAEL","PT"
150000604397,"GENILDO VIEIRA DE ANDRADE","GENILDO DO PT","PT"
150000604413,"TIOMAR HELAINE MARTINS GUIMARAES","TIOMAR HELAINE","PT"
150000604407,"MARIA MARQUES MACIEL","MARIAH","PT"
150000604410,"RICARDO SILVA DE OLIVEIRA","RICARDO OLIVEIRA","PT"
150000604406,"MARIA DAS NEVES ANDRADE DA SILVA","NEVES","PT"
150000604393,"EDIGLEI CORDEIRO GONCALVES","EDIGLEI CORDEIRO","PT"
150000604405,"MARCIO DE MATOS CANIELLO","MARCIO CANIELLO","PT"
150000604390,"ANGILINA MACENA DE PONTES","ANGILINA PONTES","PT"
150000604398,"JOAO BELO NETO","JOAO BELO","PT"
150000608806,"MOISES VIRGINIO DE BARROS","MOZA","PT"
150000604400,"JOSE PAULO VITURINO DOS SANTOS","ZE PAULO","PT"
150000629785,"LENEIDE DA SILVA","NEIDE DE LULA","PT"
150000608804,"MARCOS HENRIQUES E SILVA","MARCOS HENRIQUES","PT"
150000604394,"EDSON MARIA GOMES","PROFESSOR EDSON GOMES","PT"
150000604396,"FRANCISCO JANIO PEREIRA","PROFESSOR JANIO PEREIRA","PT"
150000604404,"MARCELINO PEREIRA NETO","MARCELO DO MERCADINHO","PT"
150000603512,"LUIZ ALBUQUERQUE COUTO","LUIZ COUTO","PT"
150000604399,"JOSÉ COSTA TEIXEIRA","ZE COSTA","PT"
150000608805,"MARIA DO SOCORRO DE PONTES BEZERRA","SOCORRO PONTES","PT"
150000604391,"ANISIO SOARES MAIA","ANISIO MAIA","PT"
150000604403,"LUZENIRA LINHARES ALVES","LUZENIRA","PT"
150000604412,"SIDINEY  DE OLIVEIRA SILVA","SIDINEY OLIVEIRA","PT"
150000604408,"RAFAEL MAXIMINO DOS SANTOS","RAFA MAX","PT"
150000604411,"SEVERINO FERREIRA DOS SANTOS","SEVERINO DO GÁS","PT"
150000604414,"ZENIVALDO DE OLIVEIRA BARBOSA","ZENIVALDO DO CONSIGNADO","PT"
150000608803,"ANTONIO RIBEIRO","FREI ANASTACIO","PT"
150000630006,"MARIA EDNA DOS SANTOS","EDNA DO BOLO","PT"
150000604392,"DALMO OLIVEIRA DA SILVA","DALMO OLIVEIRA","PT"
150000604395,"FABIANA VELOSO DOS SANTOS","FABIANA VELOSO","PT"
150000604401,"JOÃO BATISTA MARTINIANO FERREIRA","JOÃOZINHO DO GÁS","PT"
150000604402,"JULIANA DE SOUSA SILVA","JULIANA SILVA","PT"
170000621476,"MARIA LUCINEIDE DO NASCIMENTO SANTANA","NEIDE NASCIMENTO","PT"
170000621499,"LIANA CRISTINA DA COSTA CIRNE LINS","LIANA CIRNE","PT"
170000621458,"JOSÉ FRANCIS HERBERT DA CONCEIÇÃO","FRANCIS HERBERT","PT"
170000621468,"MARIA JOSÉ DA SILVA","MARIA JOSÉ DO SINDICATO","PT"
170000621491,"SYLVIA SIQUEIRA CAMPOS","SYLVIA","PT"
170000621486,"JOÃO ALFREDO DE ARAÚJO","JOAO ALFREDO","PT"
170000621493,"MARCOS HERIDIJANIO MOURA BEZERRA","DR MARCOS ORTOPEDISTA","PT"
170000621495,"MARIA TERESA LEITAO DE MELO","TERESA LEITÃO","PT"
170000621489,"ALDIONE ANTONIO DA SILVA","ALDIONE SILVA","PT"
170000621498,"MARIA SUELY DE MELO RIBEIRO","SUELY MELO","PT"
170000621465,"ROBERTO MARDONIO DE OLIVEIRA","ROBERTO MARDONIO","PT"
170000621483,"ANTONIO BATISTA FALCÃO","ANTONIO FALCÃO","PT"
170000621488,"RICARDO ANDRADE DA COSTA SILVA","RICARDO ANDRADE","PT"
170000604550,"ANA CLÁUDIA GONÇALVES FERREIRA","ANA CLÁUDIA FERREIRA","PT"
170000630017,"MARIA MÁRCIA RODRIGUES DE ALMEIDA","MARCIA DO ANGICO","PT"
170000621467,"ODACY AMORIM DE SOUZA","ODACY AMORIM","PT"
170000621470,"ERNESTO LÁZARO MAIA","ERNESTO MAIA","PT"
170000621461,"JOSÉ WELLINGTON ALVES DE CARVALHO","WELLINGTON","PT"
170000621471,"MARIA DULCICLEIDE MACEDO COELHO AMORIM","DULCICLEIDE AMORIM","PT"
170000621501,"PRISCILA DA SILVA RAMOS","PRISCILA RAMOS","PT"
170000629773,"JANAINA FERNANDES DA SILVA","JANAINA FERNANDES","PT"
170000621479,"EUCLIDES RONALDO LEITE","RONA LEITE","PT"
170000621472,"FERNANDO DANTAS FERRO","FERNANDO FERRO","PT"
170000621485,"JOÃO DA COSTA BEZERRA FILHO","JOAO DA COSTA","PT"
170000621473,"FELIPE ANDRÉ SANTOS RODRIGUES","FELIPE RODRIGUES","PT"
170000621481,"MÁRCIA LEILANE GAMA LACERDA DE ARAÚJO REIS","MÁRCIA LACERDA","PT"
170000604548,"HUMBERTO SÉRGIO COSTA LIMA","HUMBERTO COSTA","PT"
170000621464,"MARICLEITON VIEIRA DA SILVA","MARICLEITON","PT"
170000621500,"MARÍLIA VALENÇA ROCHA ARRAES DE ALENCAR","MARÍLIA ARRAES","PT"
170000621496,"DORIEL SATURNINO DE BARROS","DORIEL BARROS","PT"
170000621463,"ÁLVARO SOARES DE MELO FILHO","ÁLVARO FILHO","PT"
170000621484,"GIVANILDO JACINTO DA SILVA","RADIALISTA GIVANILDO SILVA","PT"
170000621474,"JOSÉ CARLOS VERAS DOS SANTOS","CARLOS VERAS","PT"
170000621462,"GERALDO FERREIRA DE LUCENA","MAJOR LUCENA","PT"
170000621478,"ARNALDO GUIMARÃES DA SILVA","ARNALDO DO BUTECO","PT"
170000621475,"DYANNE ANDRESSA DE LIMA BARROS","DYANNE BARROS","PT"
170000621482,"CÍCERO ROMÃO DE OLIVEIRA","CÍCERO ROMÃO","PT"
170000621490,"EDNAIPTAN DE SOUZA SILVA","EDNAÍ O SEU AGENTE DE SAÚDE","PT"
170000621480,"LEONARDO JOSÉ MARINHO DAMASCENO","LEO","PT"
170000621487,"ALMIR ANDRADE DE VASCONCELOS","ALMIR DO PT","PT"
170000621469,"GUILHERME BARBOSA DE FARIAS FILHO","GUILHERME FARIAS","PT"
170000621492,"MARIA CRISTINA COSTA DE CARVALHO","CRISTINA COSTA","PT"
170000621494,"GEOVANI DE MORAES NASCIMENTO","GEOVANI","PT"
170000629490,"GIVÂNIA MARIA DA SILVA","GIVÂNIA","PT"
170000621477,"THEREZA CHRYSTINA ELIAS CARDOSO","DRA THEREZA CARDOSO","PT"
170000621466,"JOABE VICENTE DO NASCIMENTO","JOABE VICENTE DA SAÚDE","PT"
170000621460,"LUCIMAURO ANTONIO ALVES OLIVEIRA","MAURO","PT"
170000621459,"FLÁVIA HELLEN DE OLIVEIRA GOMES","FLÁVIA HELLEN","PT"
170000621497,"SINÉZIO RODRIGUES ALVES","SINÉZIO RODRIGUES","PT"
180000614023,"FRANCISCO DE ASSIS DE OLIVEIRA COSTA","DR. FRANCISCO COSTA","PT"
180000614030,"JOAO DE DEUS SOUSA","JOAO DE DEUS","PT"
180000613940,"ANTONIO JOSE CASTELO BRANCO MEDEIROS","ANTONIO JOSE MEDEIROS","PT"
180000614032,"JOSÉ GOMES MARQUES","ZE GOMES","PT"
180000614049,"PAULO CEZAR DE SOUSA MARTINS","PAULO MARTINS","PT"
180000614057,"WARTON MATIAS LACERDA E OLIVEIRA","WARTON LACERDA","PT"
180000614016,"FABIO NUNEZ NOVO","FABIO NOVO","PT"
180000613944,"NEIDE DE JESUS CARVALHO","NEIDE CARVALHO","PT"
180000614002,"JOSÉ WELLINGTON BARROSO DE ARAÚJO DIAS","WELLINGTON DIAS","PT"
180000614040,"LUIZ HENRIQUE SOUSA DE CARVALHO","ZIZA CARVALHO","PT"
180000614050,"RAIMUNDO PEREIRA DE SOUSA FILHO","RAIMUNDO PEREIRA","PT"
180000613945,"REJANE RIBEIRO SOUSA DIAS","REJANE DIAS","PT"
180000614038,"LUCIA MARIA BATISTA","PROFESSORA LUCIA BATISTA","PT"
180000614044,"MARIA ROSALINA DOS SANTOS","MARIA DO POVO","PT"
180000613943,"LEIDA MARIA DE OLIVEIRA DINIZ","PROMOTORA LEIDA DINIZ","PT"
180000614056,"VICENTE DE SOUSA SOBRINHO","VICENTE SOBRINHO","PT"
180000614013,"CICERO MAGALHÃES OLIVEIRA","MAGALHÃES","PT"
180000614003,"MARIA REGINA SOUSA","REGINA SOUSA","PT"
180000613947,"MERLONG SOLANO NOGUEIRA","MERLONG SOLANO","PT"
180000614020,"FLORA IZABEL NOBRE RODRIGUES","FLORA IZABEL","PT"
180000613942,"FABIOLA DE AZEVEDO LEMOS","FABIOLA LEMOS","PT"
180000614022,"FRANCISCO DAS CHAGAS LIMMA","LIMMA","PT"
180000614024,"FRANCISCO JOSÉ ALVES DA SILVA","FRANZÉ SILVA","PT"
180000613941,"FRANCISCO DE ASSIS CARVALHO GONÇALVES","ASSIS CARVALHO","PT"
180000614046,"NAYARA JULIANA RIBEIRO DA COSTA","NAYARA COSTA","PT"
160000623053,"MARCIO RICARDO MARINHO","RICARDO MARINHO","PT"
160000623077,"DILTO VITORASSI","VITORASSI","PT"
160000623014,"DANIELLE CRISTINA BRAZ","DANI BRAZ","PT"
160000623070,"GLEISI HELENA HOFFMANN","GLEISI LULA","PT"
160000623016,"JOAQUIM TERTULIANO RIBAS DE ANDRADE","TERTULIANO ANDRADE","PT"
160000623036,"TONIA CARLA DE SOUZA","TONIA CARLA","PT"
160000623030,"MAURO ANTÔNIO HOLZ","MAURÃO","PT"
160000623049,"GIANE HERLLAIN","PROF. GIANE LULA HERLLAIN","PT"
160000623009,"FLORISVALDO FIER","DR. ROSINHA","PT"
160000623035,"ROBERTO DE SOUZA","ROBERTO DE SOUZA","PT"
160000623058,"ANDRE CASTELO BRANCO MACHADO","ANDRÉ MACHADO","PT"
160000623029,"MARIO SERGIO VERRI","MARIO VERRI","PT"
160000623032,"ODILA MARIA RAIZEL","ODILA RAIZEL","PT"
160000623010,"ANATERRA VIANA","ANATERRA","PT"
160000623015,"VICTÓRIA PEDRO CORRÊA","VICTÓRIA","PT"
160000623024,"MARLENE BASILIO CORRÊA","MARLENE BASILIO","PT"
160000627841,"IRACEMA DE JESUS CAMPOS","IRACEMA CAMPOS","PT"
160000623074,"LEANDRO GOMES MAIKUMA","TOTTI","PT"
160000623019,"NEVERALDO DA SILVA OLIBONI","NEVERALDO OLIBONI","PT"
160000623026,"EDENILSO DA SILVA","ZICO","PT"
160000623063,"EDINÉIA ORIBKA","EDINÉIA ORIBKA","PT"
160000623013,"JOÃOZINHO SANTANA","JOÃOZINHO SANTANA","PT"
160000623046,"EDVAR ROBSON PADILHA","ROBSON PADILHA","PT"
160000623060,"APARECIDO BIANCHO","BIANCO","PT"
160000623067,"GELSON LUIZ DE PAULA","GELSON LUIZ DE PAULA","PT"
160000623038,"ALEXANDRE FERREIRA DE CASTRO E SILVA","ALEXANDRE SILVA","PT"
160000623011,"MIRIAN APARECIDA GONÇALVES","MIRIAN GONÇALVES","PT"
160000623043,"CÍCERO PEREIRA DE SOUZA","PROFESSOR CÍCERO","PT"
160000623080,"PERICLES DE HOLLEBEN MELLO","PÉRICLES DE HOLLEBEN MELLO","PT"
160000623066,"ENIO JOSÉ VERRI","ENIO VERRI","PT"
160000627842,"ANA CAROLINA MOURA MELO DARTORA","ANA CAROLINA DARTORA","PT"
160000623027,"JOSÉ RODRIGUES LEMOS","PROFESSOR LEMOS","PT"
160000623078,"GLEITON REIS DOS SANTOS","GLEITON REIS","PT"
160000623028,"JÉSSICA LULA LIMA MAGNO","JÉSSICA MAGNO","PT"
160000623076,"MARCELO EDUARDO RIBEIRO GOMES","MARCELO GOMES","PT"
160000623017,"JOSE CARLOS BECKER DE OLIVEIRA E SILVA","ZECA DIRCEU","PT"
160000623071,"JOSE CARLOS OLIVEIRA","JOSE CARLOS","PT"
160000623033,"RENATO DE ALMEIDA FREITAS JUNIOR","RENATO FREITAS","PT"
160000623048,"GENY LEMES DA SILVA","GENY LEMES DA SILVA","PT"
160000623023,"RUI DALCION ROCHA ROSSETIM","RUI ROSSETIM","PT"
160000623020,"NILTON APARECIDO STEIN","PROF. NILTON STEIN","PT"
160000623025,"ANTONIO TADEU VENERI","TADEU VENERI","PT"
160000623068,"GIANE DE SOUZA SILVA","PROFESSORA GIANE","PT"
160000623069,"GILBERTO GRZESZEZESZYN","PROFESSOR GILBERTO","PT"
160000623040,"ANTONIO ROSNEY CARNEIRO","ANTONIO GATO PRETO ","PT"
160000623034,"RIVADAL DONIZETE PADILHA","RIVADAL","PT"
160000623079,"JOCIANE BUENO DE OLIVEIRA","JOCIANE BUENO","PT"
160000623050,"IVONE CARVALHO DOS SANTOS","IVONE DO PT","PT"
160000623073,"JOZELITO SERAFINI DA ROCHA","PROFESSOR JOZELITO","PT"
160000623042,"CARLOS ALBERTO ZANCHI","PROFESSOR CARLOS","PT"
160000623039,"ANTENOR GOMES DE LIMA","DR. ANTENOR","PT"
160000623062,"DANIEL ALBERTO TORNESI","TORNESI","PT"
160000623045,"EDNA CAMILO DANTAS","EDNA DANTAS","PT"
160000623051,"JOSIENE CRUZ","PROFESSORA JOSI CRUZ","PT"
160000623072,"JOSETE DUBIASKI DA SILVA","PROFESSORA JOSETE","PT"
160000623012,"WILSON RAMOS FILHO","XIXO","PT"
160000623065,"EDUARDO YOCHIMITSU FUJIKAWA","EDUARDO FUJIKAWA","PT"
160000623059,"ANGELA MARIA DE FATIMA PADILHA","ANGELA MARIA","PT"
160000623041,"ARILSON MAROLDI CHIORATO","ARILSON MAROLDI CHIORATO","PT"
160000628739,"SALETE APARECIDA HOESEL SCHWERTZ","SALETE SCHWERTZ","PT"
160000623061,"CÉLIA REGINA PIONTKIEVICZ","CÉLIA REGINA","PT"
160000623057,"ABEL ALVES DE OLIVEIRA","ABEL ALVES","PT"
160000623047,"FABIO RODRIGUES AMORIM","FABIO AMORIM","PT"
160000623075,"LUIZ CARLOS DA SILVA HERLLAIN","LUIZ MARIELLE HERLLAIN","PT"
160000623018,"MARCIO DE ALMEIDA RAMOS","PROFESSOR MARCIO DE COLOMBO","PT"
160000623052,"LUCIANA GUZELLA RAFAGNIN","LUCIANA RAFAGNIN","PT"
160000623022,"RODINEI PRADO DE OLIVEIRA","RODINEI PRADO","PT"
160000623021,"OSMAR ANTONIO SCHROH","PROF. OSMAR","PT"
160000623037,"ALAERTE LEANDRO MARTINS","DRA. ALAERTE MARTINS","PT"
160000623055,"AUREO NILDO XAVIER DOS SANTOS","NEGÃO DO PT","PT"
160000623031,"MOIZES DE FREITAS LEAL","LEAL","PT"
160000623044,"EDILSON JOSE GABRIEL","EDILSON GABRIEL","PT"
160000623054,"MARGARETE LOPES IUNG","MARGOT JUNG","PT"
160000623056,"CLEOMAR LEORATTO SILVEIRA","CLEOMAR GAUCHÃO DO PAVER","PT"
160000623064,"EDSON LUIS BEUREN","NEQUINHO","PT"
190000613588,"GERALDO CORREIA DE MENESES FILHO","GERALDO MENESES","PT"
190000611180,"EVERTON SAMPAIO DA SILVA ","EVERTON SAMPAIO","PT"
190000611165,"JAQUELINE GOMES DE JESUS ","PROFESSORA JAQUELINE DE JESUS","PT"
190000611190,"JOSÉ RIBAMAR DE LIMA ","RIBAMAR DADINHO ","PT"
190000611197,"NEI MIGUEZ","NEI MIGUEZ DR NEI","PT"
190000613594,"PAULO FERNANDES DE SOUZA","PAULÃO DA SAUDE ","PT"
190000611186,"JORGE FERREIRA LEAL ","JORGE LEAL ","PT"
190000611203,"ROBSON CAMPOS LEITE ","ROBSON LEITE ","PT"
190000611176,"ANTONIO ALDENISO DE OLIVEIRA ","ALDENISO DE OLIVEIRA","PT"
190000613593,"MARINALDO SILVA SANTOS ","PSICOLOGO MARINALDO ","PT"
190000611193,"MARCEL SILVANO DA SILVA SOUZA","MARCEL SILVANO","PT"
190000613579,"MARIA DAS GRAÇAS GOMES FRANCO ","GRAÇA DO PT","PT"
190000628728,"JESSICA TITIRY DA COSTA ","JÉSSICA TITIRY","PT"
190000611184,"GILBERTO SILVA PALMARES ","GILBERTO PALMARES ","PT"
190000611166,"LETICIA RIBEIRO DE OLIVEIRA","LETÍCIA FLORÊNCIO","PT"
190000613595,"PAULO PAGANINI DE SOUZA COUTINHO","MAESTRO PAULO PAGANINI","PT"
190000613581,"ROSANGELA FACANHA","FAÇANHA","PT"
190000611188,"JOSÉ AUGUSTO TELLES DE LIMA","AUGUSTO TELLES","PT"
190000611160,"CLARICE DE FREITAS SILVA AVILA ","PROFESSORA CLARICE ","PT"
190000611162,"CLAUDETE DA COSTA FERREIRA","CLAUDETE COSTA","PT"
190000613607,"EDSON ALVES SILVA JUNIOR ","EDINHO ","PT"
190000613602,"BENEDITA SOUZA DA SILVA SAMPAIO ","BENEDITA DA SILVA ","PT"
190000613580,"MARIA LUCIA COSTA SILVA ","DRA LUCIA COSTA","PT"
190000613597,"RIVALNEY DESSERBELLES PEDROSA","PEDROSA","PT"
190000611201,"ROBERCIL DA ROCHA PARREIRA ","DR.RUBINHO DA DIVINÊIA","PT"
190000611170,"PRISCILA SOARES SANTOS ","PRISCILA SOARES","PT"
190000611178,"BRUNO DE ANDRADE FERREIRA ","BRUNINHO ANDRADE","PT"
190000613589,"JOSÉ LEÃO MENEZES FILHO ","PROFESSOR LEÃO ","PT"
190000611187,"JORGE LUIZ LOPES ","JORGE COLINS","PT"
190000613599,"WADIH NEMER DAMOUS FILHO","WADIH DAMOUS","PT"
190000613583,"SIMONE SATURNINO BRAGA DE CAMPOS ","SIMONE SATURNINO BRAGA ","PT"
190000613614,"ROGERIA DOS SANTOS CARVALHO","ROGERIA CARVALHO","PT"
190000628727,"DILMA DA CONCEIÇÃO COELHO","DILMA COELHO","PT"
190000611174,"ADELSON PEREIRA GUEDES","ADELSON GUEDES","PT"
190000611185,"JORDAN OLIVEIRA COSTA ","JORDAN COSTA","PT"
190000613604,"JOSE MARIA FERREIRA RANGEL","JOSÉ MARIA RANGEL","PT"
190000613582,"ROSIMERI DA SILVA MARONGIU ","ROSE DA SILVA ","PT"
190000611163,"ELIKA TAKIMOTO","ELIKA TAKIMOTO","PT"
190000611168,"MARLI DOS SANTOS HOMEM CARVALHO","MARLI ONDA JOVEM","PT"
190000613600,"LUIZ LINDBERGH FARIAS FILHO","LINDBERGH","PT"
190000611200,"RENATO RIBEIRO DA SILVA ","RENATO RIBEIRO ","PT"
190000611205,"WALDECK CARNEIRO DA SILVA","WALDECK CARNEIRO","PT"
190000611161,"CRISTINA LINS SILVA","CRISTIAN LINS ","PT"
190000611191,"JOSÉ LUIZ MANOEL ","LUIZ TARTARUGA ","PT"
190000613606,"WASHINGTON LUIZ CARDOSO SIQUEIRA","QUAQUA","PT"
190000613585,"ADILSON NOGUEIRA PIRES","ADILSON PIRES","PT"
190000613587,"CELSO PANSERA ","CELSO PANSERA ","PT"
190000613586,"ALBERTO LUIZ VIEIRA COSTA","ALBERTO SENSATO","PT"
190000611194,"MARCELO RICARDO PRATA ","MARCELO PRATA ","PT"
190000611179,"DOUGLAS SOARES SILVA ","DOUGLAS ABOBRÃO","PT"
