"candidato_id","nome","nome_urna","partido_sigla"
10000608401,"RAQUEL GLEYCIANE SANTOS DE SOUZA","RAQUEL SOUZA","PT"
10000608384,"JOSE SELMO DANTAS ALVES","SELMO DANTAS","PT"
10000608367,"JAMES FELIX DE SOUZA","JAMES FELIX","PT"
10000615663,"MARCUS ALEXANDRE MÉDICI AGUIAR VIANA DA SILVA","MARCUS ALEXANDRE","PT"
10000608366,"JONAS DE SOUZA LIMA","JONAS LIMA","PT"
10000615657,"JORGE NEY VIANA MACEDO NEVES","JORGE VIANA","PT"
10000608371,"JAKSON ROBERO RAMOS DA SILVA","DR. JAKSON RAMOS","PT"
10000615658,"MARIA DE NAZARETH MELLO DE ARAÚJO LAMBERT","NAZARETH ARAÚJO","PT"
10000608382,"KEDMA ABIGAIL ALVES DA SILVA","KEDMA SILVA","PT"
10000608379,"ANTONIO RAIMUNDO MELONIA DE ANDRADE","REAL","PT"
10000608368,"ELINEIDE MEIRELES MEDEIROS","ELINEIDE MEIRELES","PT"
10000615662,"JOSUE BEZERRA DE AMORIM","JOSUÉ AMORIM","PT"
10000608377,"GONTRAN DE FREITAS MACIEL NETO ","GONTRAN NETO","PT"
10000615660,"JOZINEY ALVES AMORIM","NEY AMORIM","PT"
10000608364,"TEMYLLIS LIMA DA SILVA","TEMYLLIS SILVA","PT"
10000608381,"ALDEMIR DA SILVA LOPES","ALDEMIR LOPES","PT"
10000608378,"NILDSON COSTA DE MOURA","PROF. NILDSON IBERNON","PT"
10000608403,"DARLA CRISTINA PENHA ALMEIDA DE OLIVEIRA","DARLA","PT"
10000608376,"ROSANGELA MARIA SOARES DE MELO","PROF. ROSANGELA","PT"
10000608369,"DANIEL QUEIROZ DE SANT ANA","DANIEL ZEN","PT"
10000608400,"RAIMUNDO ANGELIM VASCONCELOS","ANGELIM","PT"
10000608380,"ALBERTO FERNANDES RODRIGUES","ALBERTO FERNANDES ","PT"
10000608365,"ANA LEILA GALVÃO MAIA MOREIRA","LEILA GALVÃO","PT"
10000608399,"LEONARDO CUNHA DE BRITO","LEO DE BRITO","PT"
10000608370,"LOURIVAL MARQUES DE OLIVEIRA FILHO","LOURIVAL MARQUES","PT"
10000608383,"FRANCIMAR FERNANDES DE ALBUQUERQUE","FRANCIMAR FERNANDES","PT"
10000608375,"TEREZINHA SANTANA DA SILVA","TEREZINHA SANTANA","PT"
10000615606,"GLENILSOM ARAÚJO FIGUEIREDO","NIL FIGUEIREDO","PT"
10000608363,"MARIA JOSE RODRIGUES ANTROBOS MATOS","MARIA SOU DO POVO","PT"
10000608398,"SEBASTIÃO SIBA MACHADO OLIVEIRA","SIBÁ MACHADO","PT"
20000606309,"THATIANE NICÁCIO DE ARAÚJO","THATI NICÁCIO","PT"
20000606321,"SANDRA LÚCIA DOS SANTOS LIRA","SANDRA LIRA","PT"
20000606330,"PEDRO JULIÃO PITA DE ARAÚJO","PITA","PT"
20000606336,"LUIZ GOMES DA ROCHA","PROFESSOR LUIZINHO","PT"
20000606310,"FRANCISMAR LINS DOS SANTOS","FRANCISMAR FARMACÊUTICO","PT"
20000606308,"ELIDA RACHEL MIRANDA SOUSA","ELIDA MIRANDA","PT"
20000606323,"JOSEFA MÁRCIA FERREIRA NETO","MÁRCIA MEIRELLYS","PT"
20000606335,"BENEDITO DE OLIVEIRA LIMA","BENEDITO PROCÓPIO","PT"
20000606320,"ANA MARIA PEREIRA","ANA PEREIRA","PT"
20000606338,"MARIA DO SOCORRO DA SILVA OLIVEIRA","MARIA DO SOCORRO","PT"
20000606312,"VERONILDES RODRIGUES DA SILVA","MÃE VERA","PT"
20000606316,"JOSÉ FERNANDES DA COSTA","MAESTRO FERNANDES","PT"
20000606315,"VALDYER RIBEIRO PAIVA","PASTOR VALDYER","PT"
20000606326,"NEILSON ÁVILA DA ROCHA","NEILSON ÁVILA","PT"
20000606327,"CÍCERO LINDOVAL DE OLIVEIRA","JABOQUE","PT"
20000606324,"JOSÉ ANTÔNIO TIMÓTEO DE SOUZA","ANTÔNIO TIMÓTEO","PT"
20000606331,"ROBERTO PEREIRA MARTINS","ROBERTO MARTINS","PT"
20000606325,"JOABSON NASCIMENTO SILVA","JOABSON NASCIMENTO","PT"
20000606322,"DURVAL JOÃO DOS SANTOS NETO","DURVAL GUERREIRO","PT"
20000606328,"JOSELITO DA SILVA","ZELITO MOTOS","PT"
20000606329,"JORGE SEIXAS SERAPIÃO","JORGINHO SEIXAS","PT"
20000606332,"PEDRO PAULO FARIAS DE OLIVEIRA","PEDRO PAULO","PT"
20000606311,"GIZELDA MARIA DA SILVA","PROFESSORA GIZELDA","PT"
20000606313,"FERNANDO CÂNDIDO DO NASCIMENTO","FERNANDO CÂNDIDO","PT"
20000606319,"OTHONIEL PINHEIRO NETO","OTHONIEL PINHEIRO","PT"
20000606337,"ARMANDO DA SILVA","ARMANDO DAS ANTENAS","PT"
20000606333,"DJENANE COSTA D OLIVEIRA HOLANDA","DJENANE","PT"
20000606318,"JOSÉ ARNALDO LISBOA GOMES","ZÉ ARNALDO","PT"
20000606334,"JOSE GONZAGA DE MEDEIROS","ZÉ GONZAGA","PT"
20000621937,"PAULO FERNANDO DOS SANTOS","PAULÃO","PT"
20000606317,"LESSO BENEDITO DOS SANTOS","PROFESSOR LESSO","PT"
20000606307,"GENIVALDO OLIVEIRA DA SILVA","GENIVALDO DA FETAG","PT"
20000606314,"HERMÍNIO DOS SANTOS SILVA","HERMÍNIO","PT"
40000608201,"ALVANIRA SOARES PALMELA","CACICA ALVANIRA","PT"
40000608207,"SINESIO DA SILVA CAMPOS","PROFESSOR SINESIO","PT"
40000608206,"MARIA DE FATIMA TORRES BARBOSA","FATIMA TORRES","PT"
40000608213,"FRANCISCO LUCIANO DOS SANTOS VIEIRA","LUCIANO VIEIRA","PT"
40000608214,"HAROLDO CRUZ NEVES","HAROLDO NEVES","PT"
40000608212,"FRANCISCA IVANETE OLIVEIRA DOS SANTOS SANTANA","IVANETE SANTANA","PT"
40000608209,"EDIVALDO TEIXEIRA LORDEIRO","EDI TEIXEIRA","PT"
40000608217,"MANOEL PESTANA DA GAMA","DR. PESTANA","PT"
40000608218,"MAXILIANO BATISTA BARROS","PROFESSOR MAX","PT"
40000610426,"REBECA RODRIGUES DE OLIVEIRA QUEIROZ","REBECA QUEIROZ","PT"
40000608202,"ANA CLAUDIA CHAVES BANDEIRA DE MELO","ANA CLAUDIA","PT"
40000610425,"MARIA ODIMAR DA SILVA GUIMARAES","ODIMAR GUIMARÃES","PT"
40000604137,"FRANCISCO JORGE RIBEIRO GUIMARÃES","JORGE GUIMARÃES","PT"
40000608219,"PEDRO MALTA DE ARAUJO","PEDRO MALTA ","PT"
40000608224,"WALDEMIR JOSE DA SILVA","WALDEMIR JOSE","PT"
40000610429,"JOSE RICARDO WENDLING","JOSÉ RICARDO","PT"
40000608221,"RAIMUNDO NONATO CORREIA SANTIAGO","RAIMUNDO SANTIAGO","PT"
40000608211,"EDSON DE ARAUJO SANTOS","EDSON DO COMERCIO","PT"
40000608216,"JOÃO PEDRO GONÇALVES DA COSTA","JOAO PEDRO","PT"
40000608215,"JOAO ALVES DA COSTA","JOAO BOLINHO","PT"
40000608222,"RONALD NASCIMENTO DE SEIXAS","RONALD SEIXAS","PT"
40000608220,"PERINNER JOAO FERNANDES ASSIS","PROFESSOR PERINNER ASSIS","PT"
40000608210,"EDIVAN CASTILHO FERREIRA","EDIVAN CASTILHO","PT"
40000608203,"CRISTIANE AMARAL SALES TELLES","CRISTIANE SALES","PT"
40000629879,"MARIA DO PERPÉTUO SOCORRO MARINHO PRADO","SOCORRO PRADO","PT"
40000608204,"ELIANE DA SILVA OLIVEIRA","ELIANE PEIXOTO","PT"
40000610427,"CICERO CUSTÓDIO DA SILVA","SASSÁ DA CONSTRUÇÃO CIVIL","PT"
40000629896,"THIAGO MEDEIROS","THIAGO MEDEIROS","PT"
40000608223,"VALDEMIR DE SOUZA SANTANA","VALDEMIR","PT"
40000608205,"MARIANA FERREIRA VELEZ","MARIANA FERREIRA","PT"
40000608208,"DENIS DA SILVA PEREIRA","PROFESSOR DENIS","PT"
30000604538,"IVANEIA DE SOUZA ALVES","PROFESSORA IVANEIA ALVES","PT"
30000604541,"OTAVIO JUNIOR BRITO DOS SANTOS","PROFESSOR OTÁVIO","PT"
30000604532,"EDNA MELO RIBEIRO","EDNA MELO","PT"
30000604543,"DAIMINI BRAGA DE ARAUJO","DAIMINI","PT"
30000604524,"FRANCO DE SA AIEZZA","FRANCO SÁ","PT"
30000604525,"ISAAC SILVA GOMES","ISAAC SILVA","PT"
30000604528,"SILVINO VIANA RABELO","RABELO","PT"
30000620099,"MARIA DALVA DE SOUZA FIGUEIREDO","DALVA 1313","PT"
30000620048,"IVANILDO LUCIANO DA LUZ","IVANILDO LUZ","PT"
30000604526,"RUBEM DE LIMA PACHECO JUNIOR","RUBEM JUNIOR","PT"
30000604536,"BELARMINO BORGES GOMES","TIO GIGANTE","PT"
30000630066,"SANDRA MARIA PORTAL DE ALMEIDA","SANDRA ALMEIDA","PT"
30000620095,"EDILSON VIEIRA ROCHA","ROCHA DO SUCATÃO","PT"
30000604537,"SEBASTIAO DA SILVA LEITAO","SEBASTIÃO LEITÃO","PT"
30000604539,"LUIZ REIS PINHEIRO","SARNEY PINHEIRO","PT"
30000620096,"ERROLFLYNN DE SOUZA PAIXAO","ERROLFLYNN PAIXÃO","PT"
30000620097,"JUCICLEBER FRANCISCO DA SILVA CASTRO","PROFESSOR JUCICLEBER","PT"
30000604527,"EVALDO BARROS MONTEIRO","EVALDO MONTEIRO","PT"
30000620098,"LEIDE MARIA PANTOJA FERREIRA","LEIDE FERREIRA","PT"
30000604523,"MANOEL BRAGA PINTO","BRAGA DO PT","PT"
30000620093,"ANTONIA DO SOCORRO NOGUEIRA DE SOUZA","SOCORRO NOGUEIRA","PT"
30000604542,"ISAMEYRE DA CUNHA NASCIMENTO","ISA NASCIMENTO","PT"
30000604540,"PLACIDO PEREIRA VIEIRA","PLÁCIDO VIEIRA","PT"
30000620047,"MARCO ANTONIO DE LIMA NUNES","NUNES","PT"
30000604534,"MARCELO DA SILVA","MARCELÃO DO PT","PT"
30000604529,"BEANE GOMES FERREIRA","BEANE GOMES","PT"
30000620094,"DORALICE NASCIMENTO DE SOUZA","DORA NASCIMENTO","PT"
30000620100,"ROSINETE DUARTE PACHECO","ROSE DUARTE","PT"
30000604533,"KATIA SIMONE ALMEIDA SETUBAL","KATIA SETUBAL","PT"
30000604531,"BENILSON DA SILVA VILHENA BRITO","BENILSON BRITO","PT"
30000604535,"MARIA ISABEL NOGUEIRA DE SOUSA","ISABEL NOGUEIRA","PT"
30000604530,"ANA LUCIA BANHA PICANCO NUNES","PROFESSORA LÚCIA BANHA","PT"
50000608055,"GERALDO SIMOES DE OLIVEIRA","GERALDO SIMÕES","PT"
50000620051,"VALMIR CARLOS DA ASSUNÇÃO","VALMIR ASSUNÇÃO","PT"
50000607980,"FRANCISCA ALVES RIBEIRO","CHICA DO PT","PT"
50000607985,"JOSÉ RAIMUNDO FONTES","ZÉ RAIMUNDO","PT"
50000607982,"JACKSON DOS SANTOS JOSUÉ","JACKSON","PT"
50000607990,"OSNI CARDOSO DE ARAÚJO","OSNI","PT"
50000607977,"UBIRAJARA DA SILVA RAMOS COROA","BIRA COROA","PT"
50000607793,"MANUELA CRISTINA BISPO DA CRUZ","MANU","PT"
50000607795,"CRISTINA BATISTA PORTO","CRISTINA PORTO","PT"
50000607988,"MARIA DEL CARMEN FIDALGO SANCHEZ PUGA","MARIA DEL CARMEN","PT"
50000607991,"RADIOVALDO COSTA SANTOS","RADIOVALDO","PT"
50000608012,"PAULO FERNANDO RANGEL DE LIMA","PAULO RANGEL","PT"
50000607794,"VERA LUCIA SANTOS DE JESUS","VERA LÚCIA","PT"
50000607984,"JONES DE OLIVEIRA CARVALHO","JONES CARVALHO","PT"
50000607993,"GILVÂNIA MARIA VIANA MARTINS","GILVÂNIA VIANA","PT"
50000607788,"JOSÉ CERQUEIRA DE SANTANA NETO","ZÉ NETO","PT"
50000607711,"RUI COSTA DOS SANTOS","RUI COSTA","PT"
50000607790,"ELISANGELA DOS SANTOS ARAUJO","ELISANGELA","PT"
50000607789,"AFONSO BANDEIRA FLORENCE","AFONSO FLORENCE","PT"
50000608009,"ROSIVAL LEITE DA SILVA","ROSIVAL LEITE","PT"
50000607979,"MARIA DE FATIMA NUNES DO CARMO","FÁTIMA NUNES","PT"
50000607785,"CARLOS MARTINS MARQUES DE SANTANA","CARLOS MARTINS","PT"
50000607992,"ROBINSON SANTOS ALMEIDA","ROBINSON","PT"
50000607786,"JOSEILDO RIBEIRO RAMOS","JOSEILDO RAMOS","PT"
50000607986,"LUIZ ALBERTO SILVA DOS SANTOS","LUIZ ALBERTO","PT"
50000607712,"JAQUES WAGNER","JAQUES WAGNER","PT"
50000607976,"BELDES LUIS PEREIRA RAMOS","BELDES RAMOS","PT"
50000607983,"MARIO AUGUSTO DE ALMEIDA NETO","JACÓ","PT"
50000607978,"DANILLO LIBARINO ASSUNCAO","DANILLO ASSUNÇÃO","PT"
50000608010,"KATIA CRISTINA ALVES DE SOUZA","KATIA DA SAÚDE","PT"
50000607987,"MARCELINO ANTÔNIO MARTINS GALO","MARCELINO GALO","PT"
50000607994,"ROSEMBERG EVANGELISTA PINTO","ROSEMBERG","PT"
50000607995,"LUIZ CARLOS SANTOS LIMA","LUIZ CARLOS SUICA","PT"
50000620045,"NELSON VICENTE PORTELA PELLEGRINO","PELEGRINO","PT"
50000607989,"NEUSA CADORE","NEUSA CADORE","PT"
50000607791,"LUIZ CARLOS CAETANO","CAETANO","PT"
50000607981,"ISABEL CRISTINA SANTOS GUIMARAES","ISABEL GUIMARÃES","PT"
50000608011,"SHIRLENE PEREIRA DE SOUZA","SHIRLENE SOUZA","PT"
50000620044,"JOSIAS GOMES DA SILVA","JOSIAS GOMES","PT"
50000607792,"JORGE JOSÉ SANTOS PEREIRA SOLLA","JORGE SOLLA","PT"
50000607787,"WALDENOR ALVES PEREIRA FILHO","WALDENOR PEREIRA","PT"
50000608014,"TEREZINHA GOMES TAVARES","TEREZINHA GOMES","PT"
60000612041,"MARIA ELZIVONE DE MAGALHAES BEZERRA COSTA","ELZIVONE","PT"
60000612034,"JORGE GOERSCH NETO","JORGE GOESRSCH","PT"
60000612037,"JOSE JURANCILIO DO NASCIMENTO","NASCIMENTO","PT"
60000612045,"PEDRO NETO LOBO SOARES","PEDRO LOBO","PT"
60000612073,"CLAUDIOMAR LOPES DE SOUSA","KEBA RAFAEL","PT"
60000612026,"FRANCISCO CELSO CRISOSTOMO SECUNDINO","CELSO CRISOSTOMO","PT"
60000610989,"JOSE AIRTON FELIX CIRILO DA SILVA","JOSE AIRTON","PT"
60000612023,"ELMANO DE FREITAS DA COSTA","ELMANO FREITAS","PT"
60000612044,"PAULO EMILIO CORDEIRO CAMPOS","PAULO EMILIO","PT"
60000610985,"AMILCAR XIMENES PONTE","DR AMILCAR XIMENES","PT"
60000610991,"LUIZIANNE DE OLIVEIRA LINS","LUIZIANNE","PT"
60000612038,"JOSE VERIDIANO MATOS DIAS","VERIDIANO MATOS","PT"
60000612031,"GUILHERME DE FIGUEIREDO SAMPAIO","GUILHERME","PT"
60000610995,"RAFAEL TOMYAMA TOLEDO","RAFAEL TOMYAMA","PT"
60000612046,"ROSANGELA RODRIGUES LIMA","ROSANGELA DO COCO","PT"
60000612030,"GERSON GLAYDSON HONORATO DA SILVA","PAI GERSON","PT"
60000612047,"VILANI DE SOUZA OLIVEIRA","PROFESSORA VILANI","PT"
60000610987,"CARLOS EDUARDO BEZERRA MARQUES","CARLOS EDUARDO","PT"
60000610988,"FRANCISCO CESAR NOGUEIRA DA SILVA","CESAR DO VALE","PT"
60000610984,"ALBA CRISTINA NOGUEIRA LOPES","ALBA CRISTINA","PT"
60000612032,"HILDA MARIA VANDECIR MAIA","HILDA FURACAO","PT"
60000610979,"CAMILO SOBREIRA DE SANTANA","CAMILO","PT"
60000612022,"ANA JARLINE DOS SANTOS SILVA","NEGA ANA","PT"
60000612025,"FERNANDO MATOS SANTANA","FERNANDO SANTANA","PT"
60000610990,"JOSE NOBRE GUIMARAES","GUIMARAES","PT"
60000612029,"FRANCISCO JOSE TEIXEIRA","DEDE TEIXEIRA","PT"
60000612039,"MARCOS VENICIOS NORJOSA GONZAGA","DR. MARCOS NORJOSA","PT"
60000612040,"MARIA ALICE DE OLIVEIRA","ALICE OLIVEIRA","PT"
60000612036,"JOSE CELIO CAVALCANTE FILHO","CELIO","PT"
60000610986,"ANIZIO SANTOS DE MELO","ANIZIO MELO","PT"
60000612043,"MOISES BRAZ RICARDO","MOISES BRAZ","PT"
60000612033,"JOAO TRIGUEIRO DOS SANTOS NETO","JOÃO CORAGEM","PT"
60000612035,"JOSE ACRISIO DE SENA","ACRISIO SENA","PT"
60000610993,"MARIA DE LOURDES PAZ FELIX","LOURDINHA FELIX","PT"
60000610994,"RACHEL XIMENES MARQUES","RACHEL MARQUES","PT"
60000612042,"MAX SWELL VERAS RIBEIRO","MAX SWELL RIBEIRO","PT"
60000612027,"FRANCISCO DENIS DE OLIVEIRA SOUZA","DENIS OLIVEIRA","PT"
60000612074,"TERESINHA DE JESUS DOS SANTOS","PROFESSORA TERESINHA","PT"
60000610992,"MARIA DE FATIMA OLIVEIRA SILVA","FATIMA OLIVEIRA","PT"
60000612024,"ERIKA VIEIRA LIMA CARVALHO","ERIKA LOKA","PT"
60000612028,"FRANCISCO IVAN LIMA","IVAN LIMA","PT"
70000610833,"WASNY NAKLE DE ROURE","WASNY","PT"
70000610809,"ERICO GRASSI CADEMARTORI","ERICO GRASSI","PT"
70000610808,"WALDICEIA DE MORAES TEIXEIRA DA SILVA","PASTORA WALL","PT"
70000610804,"HELLEN CRISTHYAN CORREIA BOAVENTURA","HELLEN FRIDA","PT"
70000610822,"JOSE LUIS DIAS BORGES","LUISINHO","PT"
70000610830,"JULIO FLAVIO GAMEIRO MIRAGAYA","JÚLIO MIRAGAYA","PT"
70000610853,"WALTER CELIO DE ALMEIDA","WALTER CELIO","PT"
70000610798,"RODRIGO LOPES BRITTO","RODRIGO BRITTO","PT"
70000610849,"ANTONIO SABINO DE VASCONCELOS NETO","SABINO","PT"
70000610837,"ERIKA JUCA KOKAY","ERIKA KOKAY","PT"
70000610814,"LUIZA GONZAGA GOMES DE SÁ","LUIZA GOMES","PT"
70000610850,"GÉSSYCA ALVES DE SOUZA","GESSYCA","PT"
70000610820,"RICARDO GUANABARA LEAL","GUANABARA","PT"
70000610842,"OSNI DE SOUZA CALIXTO","OSNI CALIXTO","PT"
70000610805,"RICARDO VALE DA SILVA","RICARDO VALE","PT"
70000610811,"VIRIDIANO CUSTODIO DE BRITO","VIRIDIANO BRITO","PT"
70000610801,"ELICEUDA SILVA DE FRANÇA","PROFESSORA ELICEUDA","PT"
70000610818,"REGINA LUCIA TOME DOS SANTOS","REGINA TOMÉ","PT"
70000610825,"JOSE VICENTE RODRIGUES DA SILVA","PROFESSOR VICENTE","PT"
70000610817,"FRANCISCO DOMINGOS DOS SANTOS","CHICO VIGILANTE","PT"
70000610843,"REBECA GOMES DE FREITAS","REBECA GOMES","PT"
70000610852,"ROBERTO CARLOS PINHEIRO SOUSA","TIM","PT"
70000610828,"JOSE VASCONCELOS CAMPOS DE SOUZA","PROFESSOR VASCO","PT"
70000610800,"SANTIAGO DA SILVA FRANÇA","DR. SANTIAGO","PT"
70000610839,"GERALDO MAGELLA ALMEIDA SALVADO","MAGELLINHA","PT"
70000610834,"ABIAS DE SOUSA SILVA","ABIAS DE SOUSA SILVA","PT"
70000610823,"LUCIMAR ALVES MARTINS","LUCIMAR","PT"
70000610803,"GLAUCO DE SILVA E SILVA","PROFESSOR GLAUCO","PT"
70000610846,"OLGA CRISTINA ROCHA DE FREITAS","OLGA CRISTINA","PT"
70000610836,"DANIEL QUEIROZ GALVÃO","DANIEL PXEIRA","PT"
70000610802,"MARIA DE DEUS COELHO ROCHA FARIA","PROFESSORA DEUSINHA","PT"
70000610821,"RONALDO UBIRAJARA DO CARMO","RONALDO CARMO","PT"
70000610824,"DARCY LUIZ DE OLIVEIRA","DARCY LUIZ","PT"
70000610806,"MICHEL PLATINI GOMES FERNANDES","MICHEL PLATINI","PT"
70000610827,"MARIANA ROSA MOREIRA DOS SANTOS","MARIANA ROSA","PT"
70000610841,"LUIZ FERNANDO CASTELO BRANCO REBELLO HORTA","FERNANDO HORTA","PT"
70000610810,"LEILA REGINA LOPES","NEGALAIZE","PT"
70000610844,"VANESSA NEGRINI","VANESSA É O BICHO","PT"
70000610847,"IOLANDA RODRIGUES ROCHA","IOLANDA RODRIGUES  ROCHA","PT"
70000610838,"EXPEDITO AFONSO VELOSO","EXPEDITO VELOSO","PT"
70000610819,"VANDERLEI MACIEL LIMA","WANDER MACIEL","PT"
70000610799,"JUAREZ PAULINO DE MEDEIROS","JUAREZ PAULINO","PT"
70000610813,"JOSMAILTON INACIO LOPES","JOSMAILTON","PT"
70000610831,"CLAUDIA PEREIRA FARINHA","CLAUDIA FARINHA","PT"
70000610851,"MARIA AMERICA MENEZES BONFIM HAMU","AMERICA BONFIM","PT"
70000610796,"ROBERTO POLICARPO FAGUNDES","POLICARPO","PT"
70000610845,"CRISTIANE PEREIRA DOS SANTOS","CRIS SANTOS","PT"
70000610807,"ARLETE AVELAR SAMPAIO","ARLETE SAMPAIO","PT"
70000610840,"JOAQUIM RODRIGUES DOS SANTOS FILHO","JOAQUIM RODRIGUES","PT"
70000610816,"OSVANILDO LOURENSO DA SILVA","OSVANILDO LOURENSO","PT"
70000610826,"FRANCISCO DE ASSIS DOS SANTOS","FRANCISCO DA M NORTE","PT"
70000610835,"ANA CRISTINA ROBERTO","CRISTINA ROBERTO","PT"
70000610797,"GERALDO MAGELA PEREIRA","MAGELA","PT"
70000610848,"JOSE ALVES DA SILVA","ZE ALVES","PT"
70000610829,"THELMA REGINA VIEIRA DE MELLO","THELMA MELLO","PT"
70000610815,"ALISSON LUIZ DE MACEDO VEIRA","ALLISSON RENOVAÇÃO","PT"
70000610812,"ALDEMIO OGLIARI","ALDEMIO OGLIARI","PT"
70000610832,"MARCELO DA COSTA PINTO NEVES","MARCELO NEVES","PT"
80000626754,"AILTON PEREIRA DOS SANTOS","AILTON PEREIRA","PT"
80000626731,"MARCIA CARVALHO FERREIRA","MARCIA CARVALHO","PT"
80000626729,"MARCO ANTONIO MENDONÇA MOROZESKY","MOROBA","PT"
80000626755,"IRINY NICOLAU CORRES LOPES","IRINY LOPES","PT"
80000626726,"BRUNA MARIA BARBIERI","BRUNA BARBIERI","PT"
80000626741,"MARCOS DOS SANTOS","MARQUINHO SANTOS","PT"
80000626751,"FABIO JUNIO DIAS DA SILVA","FABIO JUNIO","PT"
80000626743,"LOURIVAL ZEFERINO PEREIRA","LOURIVAL DO PT","PT"
80000626730,"LUARA RAMOS SOUZA","LUARA","PT"
80000626740,"VALTER PIRES PEREIRA SCHIAVO","PROF. MC VALTINHO","PT"
80000626747,"MARCELA ROMÃO SILVA","MARCELA ROMÃO","PT"
80000626732,"EDUARDO DA COSTA PAIVA","EDUARDO LULA PAIVA","PT"
80000626742,"ELIAS DA CRUZ RIBEIRO","ELIAS O BAIANO","PT"
80000626746,"JORGE CORREIA MACIEL DOS SANTOS","JORGE DA PIEDADE","PT"
80000626737,"HONORIO JOSE DE SIQUEIRA","PADRE HONÓRIO","PT"
80000626753,"THIAGO MAGNO SILVA DE ALMEIDA","THIAGO MAGNO","PT"
80000626733,"CAETANO ROQUE DA SILVA","CAETANO","PT"
80000626722,"JACKELINE OLIVEIRA ROCHA","JACKELINE ROCHA 13","PT"
80000626748,"CLEBER PEREIRA DE LANES","CLEBER LANES","PT"
80000626745,"JOÃO CARLOS COSER","JOÃO COSER","PT"
80000626757,"LEIDE MARIA FAGUNDES ALVES","LEIDE","PT"
80000626759,"ISABELLY SOUZA PEREIRA","ISA SOUSA","PT"
80000626734,"ANTONIO CARVALHO","CACIQUE TONINHO GUARANI","PT"
80000626738,"JOSÉ CARLOS NUNES DA SILVA","NUNES","PT"
80000626739,"PATRICIA TEIXEIRA MOSCHEN LIEVORE","PROFESSORA PATRICIA","PT"
80000626736,"HELDER IGNACIO SALOMÃO","HELDER SALOMÃO","PT"
80000626749,"CELIA MARIA VILELA TAVARES","CÉLIA TAVARES","PT"
80000626724,"JOSINETE MARA DA FONSECA","JOSINETE","PT"
80000626744,"JOSE IZIDORO RODRIGUES","ZÉ IZIDORO","PT"
80000626725,"GESSIMARA SOUSA","GESSIMARA","PT"
80000626756,"MARIA LUIZA CASOTTI LOUZADA","COTINHA","PT"
80000626760,"ROGERIO DIAS CIDADE","EOGERIO CIDADE","PT"
80000626735,"DANIEL SIDNEY COSTA","DANIEL COSTA","PT"
80000626758,"TADEU VILLANOVA DE MELLO","TADEU VILLANOVA","PT"
80000626723,"JACIARA TEIXEIRA DO NASCIMENTO","JACIARA ","PT"
80000626728,"MARIA DE LOURDES BARCELLOS","FORTALEZA","PT"
80000626750,"INÊS SIMON FERREIRA","INÊS","PT"
80000626752,"PERLY CIPRIANO","PERLY CIPRIANO","PT"
80000626727,"CARLOS ROBERTO CASTEGLIONE DIAS","CARLOS CASTEGLIONE","PT"
90000619132,"TADEU RIBEIRO DA COSTA","TADEU COSTA","PT"
90000619161,"MONICA PASSOS DE MELO","MONICA PASSOS","PT"
90000619159,"JULIO ANDERSON ALVES BUENO","PROFESSOR JULIO ANDERSON","PT"
90000619163,"JOÃO RODRIGUES DA COSTA","PROF JOÃO RODRIGUES","PT"
90000619136,"ODIMAR FERREIRA BARROS","BARROS DA SAUDE","PT"
90000619105,"LUÍS CESAR BUENO E FREITAS","LUIS CÉSAR BUENO","PT"
90000619135,"JADIEL DE OLIVEIRA AZEVEDO","PROFESSOR JADIEL","PT"
90000619138,"JOSÉ DE JESUS MATOS","JOTINHA","PT"
90000619166,"MÁRCIO JOSÉ MARTINS","MÁRCIO MARTINS","PT"
90000619167,"DAYANNE BATISTA DO PRADO","DAYANNE BATISTA","PT"
90000619097,"NELSON GONÇALVES GALVÃO","NELSON GALVÃO","PT"
90000619121,"ADEMIM SANTOS SILVA","ADEMIM DEPUTADO","PT"
90000619164,"GEAN CARLOS LACERDA SOUTO","CARLOS LACERDA","PT"
90000619104,"UANDER MARCOS DE PAULA E SILVA","UANDER MARCOS","PT"
90000619123,"LUIZ ANTÔNIO DE CARVALHO","LUIZ ANTÔNIO","PT"
90000619124,"MATEUS FERREIRA DA SILVA","MATEUS FERREIRA","PT"
90000619115,"JORGE CASTILHO DE ALBUQUERQUE ARAUJO","JORGE CASTILHO","PT"
90000619125,"MAURO RUBEM DE MENEZES JONAS","MAURO RUBEM","PT"
90000619162,"ANA MARIA DA SILVA","ANA MARIA DA SILVA","PT"
90000619109,"SORMANI IRINEU RIBEIRO","SORMANI IRINEU","PT"
90000619096,"ARQUIDONES BITES LEÃO LEITE","ARQUIDONES BITES","PT"
90000629598,"THAIS GONDIM COSTA","THAIS GONDIM","PT"
90000619098,"ADRIANA SAUTHIER ACCORSI","DELEGADA ADRIANA ACCORSI","PT"
90000619170,"CILMAR MARQUES PEREIRA","CILMAR MARQUES","PT"
90000619137,"RAIMUNDO MARTINS DE LOIOLA FILHO","LOIOLA","PT"
90000619129,"JOSE DO CARMO ALVES SIQUEIRA","PROFESSOR  ZÉ DO CARMO","PT"
90000619110,"EMERSON SOARES MOREIRA","EMERSON SALSICHA","PT"
90000619112,"RUBENS OTONI GOMIDE","RUBENS OTONI","PT"
90000619158,"ANTONIO BITES LEAO","PROFESSOR ANTONIO BITES","PT"
90000619133,"ALANNA HOSANA ALBERNAZ","ALANNA ALBERNAZ","PT"
90000619117,"SEVERO DE OLIVEIRA LIMA","SEVERO LIMA","PT"
90000619128,"GUILHERME OLIVEIRA BORGES","GUILHERME DA SAÚDE","PT"
90000619103,"FREDERICO CHARLES SÁBIO NASSIF","FREDERICO NASSIF","PT"
90000619120,"ELBANY FERREIRA","ELLBANY FERREIRA","PT"
90000619131,"SUZANA SOUSA CARVALHO FERREIRA","SUZANA  CARVALHO","PT"
90000619099,"WELTON DIVINO DAS DORES DE SOUSA","WELTON DIVINO","PT"
90000619106,"PAULO ALVES DE OLIVEIRA","PAULO ALVES","PT"
90000619100,"ANTÔNIO ROBERTO OTONI GOMIDE","ANTÔNIO GOMIDE","PT"
90000619118,"WALCY CALIXTO VIEIRA","WALCY CALIXTO MICK JAGGER","PT"
90000619113,"ERNESTO MOLINARI JÚNIOR","PROFESSOR ERNESTO MOLINARI","PT"
90000619169,"KEDMA KAREN DA SILVA","KEDMA KAREN","PT"
90000619107,"MARIA GELI SANCHES","PROFESSORA GELI","PT"
90000619114,"ESTER FERNANDES DE CASTRO","ESTER QUILOMBOLA","PT"
90000619165,"NEUSA VALADARES SIQUEIRA","PROFESSORA NEUSA","PT"
90000619111,"ISABEL CRISTINE DIAS DOS SANTOS","ISABEL CRISTINE","PT"
90000628443,"CATARINO JOSÉ DA SILVA","CATARINO  SILVA","PT"
90000619130,"MARIA REGINA GOMES DA COSTA","MARIA REGINA","PT"
90000619122,"LUCIMAR CONCEIÇÃO DO NASCIMENTO","PROFESSORA LUCIMAR","PT"
90000619116,"MAURÉLIO MOREIRA DE ARAÚJO","PROFESSOR MAURÉLIO CERRADO","PT"
90000619101,"KÁTIA  MARIA DOS SANTOS","KÁTIA MARIA","PT"
90000619102,"ALTAMIR GUALBERTO SALGADO","PROFESSOR MIRIM","PT"
90000619134,"CARLOS ALBERTO SILVA","CARLOS DO ITAPUÃ","PT"
90000619127,"ANTONIO MARTINS DE OLIVEIRA","ANTONIO BAIANO","PT"
90000619126,"GERALDO NUNES DOS SANTOS","GERALDO NUNES (GERALDINHO)","PT"
100000616273,"JUCIANE MARQUES FERNANDES","JUCIANE MARQUES","PT"
100000616307,"VALQUIRIA DAS NEVES RIBEIRO","VALQUIRIA DAS NEVES","PT"
100000628191,"ANIBAL DA SILVA LINS","ANIBAL LINS","PT"
100000628506,"LINDOMAR LOPES DE SOUSA","LINDOMAR DA ALVORADA","PT"
100000616311,"ORLANDO SOUSA PINTO FILHO","DR. ORLANDO","PT"
100000616271,"JEAN MARCELO SILVA PINHEIRO","JEAN MARCELO","PT"
100000616302,"CLEINALDO CASTRO LOPES","CLEINALDO BIL","PT"
100000616294,"TEREZA CRISTINA PEREIRA MELO","CRIS DE BACABAL","PT"
100000616277,"FRANCISCO DAS CHAGAS ROSA DO NASCIMENTO","CHAGAS ROSA","PT"
100000616278,"HONORATO LEITE FERNANDES FILHO","HONORATO","PT"
100000616269,"GENILSON ROBERTO ALVES SILVA","GENILSON ALVES","PT"
100000616281,"IANDECY FERNANDES REGADAS","IANDECY REGADAS","PT"
100000628511,"PABLO ROCHA PEREIRA DO AMARAL","PABLO ROCHA","PT"
100000616267,"ELISABETE MOTA TODA","BETH MOTA","PT"
100000616303,"ANTONIO CARLOS BARRETO DA SILVA","CARLOS BARRETO","PT"
100000616285,"JOAO VITOR DE SENA CAMPOS","JOJO CAMPOS","PT"
100000616297,"RAIMUNDO JOSE CAMPOS","CAMPOS VIGILANTE","PT"
100000616290,"JOSE COSTA E SILVA","COSTA E SILVA","PT"
100000628513,"ALBINO PEREIRA MACHADO","ALBINO MACHADO","PT"
100000616275,"JOSE FERREIRA COSTA","PROFESSOR ZE COSTA","PT"
100000629649,"OSILANDIA BRITO LEITE","OSILANDIA BRITO","PT"
100000616272,"JOAB JEREMIAS PEREIRA DE CASTRO","JOAB","PT"
100000616280,"ARMANDO NOBRE DA SILVA","ARMANDO NOBRE","PT"
100000628508,"PAULO CESAR RIBEIRO LOBATO","PAULO CESAR DE PEDRO D ROSARIO","PT"
100000616317,"JOSE FRANCISCO LIMA NERES","DR. ZE FRANCISCO","PT"
100000628195,"ERIONALDSON DOS SANTOS CASTRO","ERI CASTRO","PT"
100000616296,"RAYLSON KOS SANTOS","RAYLSON KOS","PT"
100000629407,"FRANCISCA DAS CHAGAS RAMOS DE SOUZA","FRANCISCA DAS CHAGAS","PT"
100000616316,"MARIA DO SOCORRO CHAVES DE FRANÇA","SOCORRO FRANÇA","PT"
100000616314,"RAFAEL BARROS ALMEIDA","RAFAEL ALMEIDA","PT"
100000616270,"IEDA MARIA SILVA","IEDA MARIA","PT"
100000616289,"RAIMUNDO PEREIRA DE SOUZA","RAIMUNDO PEREIRA","PT"
100000616276,"CREUSAMAR DE PINHO","CREUZAMAR","PT"
100000616293,"JOSE CARLOS NUNES JUNIOR","ZE CARLOS","PT"
100000616291,"CARLA MARIA MOREIRA MACHADO","CARLA MACHADO","PT"
100000629406,"ELISABETE OLIVEIRA FERREIRA","ELISABETE FERREIRA","PT"
100000616300,"JOSE INACIO SODRE RODRIGUES","ZE INACIO","PT"
100000616284,"IVAN SRUTROVSKI VIEIRA","IVAN SRUTROVSKI","PT"
100000628197,"VALQUIRIA BATISTA LIMA","VALQUIRIA BATISTA","PT"
100000616306,"ELPIDIA PEREIRA DOS SANTOS","ELPIDIA","PT"
100000629560,"NAIR CARVALHO NEVES","NAIR CARVALHO","PT"
100000629717,"MARIA CAMARA","MARIA CAMARA","PT"
100000616288,"RAIMUNDO MONTEIRO DOS SANTOS","MONTEIRO","PT"
100000616299,"KATIA CILENE CAMPOS ALMEIDA","KATIA CILENE","PT"
100000616282,"AURELIO GOMES DA SILVA","AURELIO","PT"
100000616308,"JOSE RIBAMAR RODRIGUES FILHO","RODRIGO COMERCIARIO","PT"
100000616301,"EVANDRO OLIVEIRA SIQUEIRA","EVANDRO SIQUEIRA","PT"
100000616287,"MARCOS AURELIO RODRIGUES COSTA","MARCO DOS GUARAS","PT"
100000616312,"FRANCISCO ROGERIO SOUSA","ROGERIO DO PT","PT"
100000616295,"SAYD RODRIGUES ZAIDAN","SAYD ZAIDAN","PT"
100000616268,"HENRIQUE ELIAS COELHO CARNEIRO","HENRIQUE CARNEIRO","PT"
100000629405,"SILVIA AMELIA PEREIRA BRITO","SILVIA BRITO","PT"
100000616304,"ADAILTON MARTINS DOS SANTOS","ADAILTON MARTINS","PT"
100000616309,"MARIA HELENA DA SILVA FREITAS","HELENA FREITAS","PT"
100000628505,"JOAO BATISTA CORREA COSTA","BATISTA AXE","PT"
100000616292,"NEY JEFFERSON PEREIRA TEIXEIRA","NEY JEFFERSON LULA","PT"
100000616286,"LUIZ PEDRO DE OLIVEIRA E SILVA","LUIZ PEDRO","PT"
